{
  "type": "aiir.commit_receipt",
  "schema": "aiir/commit_receipt.v1",
  "version": "1.0.4",
  "commit": {
    "sha": "2f92dfba8f9cc7bae72687ad486a817e547e1c90",
    "author": {
      "name": "Invariant Systems",
      "email": "noah@invariantsystems.io",
      "date": "2026-03-08T10:37:30-04:00"
    },
    "committer": {
      "name": "Invariant Systems",
      "email": "noah@invariantsystems.io",
      "date": "2026-03-08T10:37:40-04:00"
    },
    "subject": "fix(ci): use refs/tags/ for floating tag verification",
    "message_hash": "sha256:40fcede266dc0e996901a7003ad5c77cb5728ae86fc2339d75975d4ff0f9aac3",
    "diff_hash": "sha256:771bfc76f307202393fbf1f42046f15ff8274b9c98aae66f660a26bf15a409f7",
    "files_changed": 1,
    "files": [
      ".github/workflows/update-major-tag.yml"
    ]
  },
  "ai_attestation": {
    "is_ai_authored": false,
    "signals_detected": [],
    "signal_count": 0,
    "is_bot_authored": false,
    "bot_signals_detected": [],
    "bot_signal_count": 0,
    "detection_method": "heuristic_v2"
  },
  "provenance": {
    "repository": "https://github.com/invariant-systems-ai/aiir",
    "tool": "https://github.com/invariant-systems-ai/aiir@1.0.4",
    "generator": "aiir.cli"
  },
  "receipt_id": "g1-c41ff524571b215ac2bdb858a79307ba",
  "content_hash": "sha256:c41ff524571b215ac2bdb858a79307ba0db8a682e050aeba4f01d3ef27af2dd1",
  "timestamp": "2026-03-08T14:37:53Z",
  "extensions": {}
}
