{
  "type": "aiir.commit_receipt",
  "schema": "aiir/commit_receipt.v1",
  "version": "1.0.3",
  "commit": {
    "sha": "ffe121f797506f5f2c72e00e005ad7d312246eb4",
    "author": {
      "name": "Invariant Systems",
      "email": "noah@invariantsystems.io",
      "date": "2026-03-08T09:04:36-04:00"
    },
    "committer": {
      "name": "Invariant Systems",
      "email": "noah@invariantsystems.io",
      "date": "2026-03-08T09:04:42-04:00"
    },
    "subject": "fix(sync): escape single-quote in version regex to avoid Python SyntaxError",
    "message_hash": "sha256:49d755a035ca79aba717c49bf28dbfa3932284e3869d899f538e6e4afeebd066",
    "diff_hash": "sha256:8034ae3389f208a1d44900ac796df45bcb7834f530311cbad4f23d6c10b837ba",
    "files_changed": 1,
    "files": [
      ".github/workflows/sync.yml"
    ]
  },
  "ai_attestation": {
    "is_ai_authored": false,
    "signals_detected": [],
    "signal_count": 0,
    "detection_method": "heuristic_v1"
  },
  "provenance": {
    "repository": "https://github.com/invariant-systems-ai/aiir",
    "tool": "https://github.com/invariant-systems-ai/aiir@1.0.3",
    "generator": "aiir.cli"
  },
  "receipt_id": "g1-8fd8827e27c95825b058907d8b8c56b8",
  "content_hash": "sha256:8fd8827e27c95825b058907d8b8c56b81948941236958d9cb3de58f986286808",
  "timestamp": "2026-03-08T13:04:53Z",
  "extensions": {}
}
