{
  "type": "aiir.commit_receipt",
  "schema": "aiir/commit_receipt.v1",
  "version": "1.0.8",
  "commit": {
    "sha": "304b4b8f36f277bfce0ddb44080890de31fd4bdb",
    "author": {
      "name": "Invariant Systems",
      "email": "noah@invariantsystems.io",
      "date": "2026-03-08T13:22:44-04:00"
    },
    "committer": {
      "name": "Invariant Systems",
      "email": "noah@invariantsystems.io",
      "date": "2026-03-08T13:22:53-04:00"
    },
    "subject": "v1.0.8: autonomous hardening — Dependabot, action-health smoke tests, OSSF Scorecard, drift auto-issues, input validation",
    "message_hash": "sha256:eaf564df5a738c2acc7e7643f4a23e5aea85ad6125ce8b05fe6091d91da64f88",
    "diff_hash": "sha256:083d4e94b403178912605258e07a257d11c3b092b47deeb85b64dd84ea05c7e2",
    "files_changed": 16,
    "files": [
      ".github/dependabot.yml",
      ".github/workflows/action-health.yml",
      ".github/workflows/scorecard.yml",
      ".github/workflows/sync.yml",
      ".pre-commit-hooks.yaml",
      "CHANGELOG.md",
      "README.md",
      "THREAT_MODEL.md",
      "action.yml",
      "aiir/__init__.py",
      "templates/azure-pipelines.yml",
      "templates/bitbucket-pipelines.yml",
      "templates/circleci/config.yml",
      "templates/gitlab-ci.yml",
      "templates/jenkins/Jenkinsfile",
      "templates/receipt/template.yml"
    ]
  },
  "ai_attestation": {
    "is_ai_authored": false,
    "signals_detected": [],
    "signal_count": 0,
    "is_bot_authored": false,
    "bot_signals_detected": [],
    "bot_signal_count": 0,
    "authorship_class": "human",
    "detection_method": "heuristic_v2"
  },
  "provenance": {
    "repository": "https://github.com/invariant-systems-ai/aiir",
    "tool": "https://github.com/invariant-systems-ai/aiir@1.0.8",
    "generator": "aiir.cli"
  },
  "receipt_id": "g1-04dd5dfcaa1fd849e1f4103715dd7b0b",
  "content_hash": "sha256:04dd5dfcaa1fd849e1f4103715dd7b0b66b0d03d75dd94d3a483c9f0e1f02c0a",
  "timestamp": "2026-03-08T17:23:08Z",
  "extensions": {}
}
