{
  "type": "aiir.commit_receipt",
  "schema": "aiir/commit_receipt.v1",
  "version": "1.0.0",
  "commit": {
    "sha": "903eb895f01e5522164be15d66137c5aa5a8e91b",
    "author": {
      "name": "Invariant Systems",
      "email": "noah@invariantsystems.io",
      "date": "2026-03-07T21:30:57-05:00"
    },
    "committer": {
      "name": "Invariant Systems",
      "email": "noah@invariantsystems.io",
      "date": "2026-03-07T21:31:11-05:00"
    },
    "subject": "feat: add badge, stats, and check commands",
    "message_hash": "sha256:2237b04ca5bc24700ec3501974823a7de69e996b54f4827075a39adfefbe0b5c",
    "diff_hash": "sha256:52dc68d9775050e0ead76195bf7e3567d3159f8586cb6cdd9390a607090444b1",
    "files_changed": 4,
    "files": [
      ".aiir/index.json",
      ".aiir/receipts.jsonl",
      "aiir/cli.py",
      "test_cli.py"
    ]
  },
  "ai_attestation": {
    "is_ai_authored": false,
    "signals_detected": [],
    "signal_count": 0,
    "detection_method": "heuristic_v1"
  },
  "provenance": {
    "repository": "https://github.com/invariant-systems-ai/aiir",
    "tool": "https://github.com/invariant-systems-ai/aiir@1.0.0",
    "generator": "aiir.cli"
  },
  "receipt_id": "g1-1afa1522cb42eadf96f7194445def5ef",
  "content_hash": "sha256:1afa1522cb42eadf96f7194445def5ef02a72b09ea47ffab238c279dbfe3a21a",
  "timestamp": "2026-03-08T02:31:25Z",
  "extensions": {}
}
