{
  "type": "aiir.commit_receipt",
  "schema": "aiir/commit_receipt.v1",
  "version": "1.0.0",
  "commit": {
    "sha": "a242af689c36bcddc479d3e2117f277c8f8f483a",
    "author": {
      "name": "Invariant Systems",
      "email": "noah@invariantsystems.io",
      "date": "2026-03-08T06:16:53-04:00"
    },
    "committer": {
      "name": "Invariant Systems",
      "email": "noah@invariantsystems.io",
      "date": "2026-03-08T06:17:02-04:00"
    },
    "subject": "ci: add Windows/macOS to test matrix, portable smoke test, OS classifier",
    "message_hash": "sha256:2265e82cb72bd8d706fc72960f0991462286bff76c57d2522a4cad5692072e78",
    "diff_hash": "sha256:ae99a94861ece08900fe72e256967ec01d718887712ba93030cd55ece64e5790",
    "files_changed": 2,
    "files": [
      ".github/workflows/ci.yml",
      "pyproject.toml"
    ]
  },
  "ai_attestation": {
    "is_ai_authored": false,
    "signals_detected": [],
    "signal_count": 0,
    "detection_method": "heuristic_v1"
  },
  "provenance": {
    "repository": "https://github.com/invariant-systems-ai/aiir",
    "tool": "https://github.com/invariant-systems-ai/aiir@1.0.0",
    "generator": "aiir.cli"
  },
  "receipt_id": "g1-17f6a785b6cede21377c3f00595940ed",
  "content_hash": "sha256:17f6a785b6cede21377c3f00595940ed812615d818085df68e74bdd5a56f4685",
  "timestamp": "2026-03-08T10:17:14Z",
  "extensions": {}
}
