{
  "type": "aiir.commit_receipt",
  "schema": "aiir/commit_receipt.v1",
  "version": "1.0.2",
  "commit": {
    "sha": "4777186a15bcd7dc7a939e0b9ca5b024283243d4",
    "author": {
      "name": "Invariant Systems",
      "email": "noah@invariantsystems.io",
      "date": "2026-03-08T07:26:46-04:00"
    },
    "committer": {
      "name": "Invariant Systems",
      "email": "noah@invariantsystems.io",
      "date": "2026-03-08T07:26:54-04:00"
    },
    "subject": "feat: GitLab CI/CD Catalog component + multi-platform CI templates + Docker",
    "message_hash": "sha256:616b1ba91b7b90a71e8ea76341a36591d0dc68ba2d456e5e042a6f8ffa78594d",
    "diff_hash": "sha256:1d9d32816c549320bd862b5178a50e943cfaa246e75295fd81f005b21961ad36",
    "files_changed": 10,
    "files": [
      ".dockerignore",
      ".gitlab-ci.yml",
      "Dockerfile",
      "README.md",
      "templates/azure-pipelines.yml",
      "templates/bitbucket-pipelines.yml",
      "templates/circleci/config.yml",
      "templates/jenkins/Jenkinsfile",
      "templates/receipt/README.md",
      "templates/receipt/template.yml"
    ]
  },
  "ai_attestation": {
    "is_ai_authored": false,
    "signals_detected": [],
    "signal_count": 0,
    "detection_method": "heuristic_v1"
  },
  "provenance": {
    "repository": "https://github.com/invariant-systems-ai/aiir",
    "tool": "https://github.com/invariant-systems-ai/aiir@1.0.2",
    "generator": "aiir.cli"
  },
  "receipt_id": "g1-02998b3c6e9fe975fd4cc566e7bea35a",
  "content_hash": "sha256:02998b3c6e9fe975fd4cc566e7bea35aa6cd7caaef41dd598ee524df788e8ae5",
  "timestamp": "2026-03-08T11:27:08Z",
  "extensions": {}
}
