{
  "type": "aiir.commit_receipt",
  "schema": "aiir/commit_receipt.v1",
  "version": "1.0.3",
  "commit": {
    "sha": "d5af4cb978e17c3a8c4f6c7a3fcb31b0cea26276",
    "author": {
      "name": "Invariant Systems",
      "email": "noah@invariantsystems.io",
      "date": "2026-03-08T10:09:18-04:00"
    },
    "committer": {
      "name": "Invariant Systems",
      "email": "noah@invariantsystems.io",
      "date": "2026-03-08T10:09:34-04:00"
    },
    "subject": "chore: bump version to 1.0.4, update changelog",
    "message_hash": "sha256:88f37770f8643938a20641f9d7366f6939fe144ccc06906e8266a819c6c81886",
    "diff_hash": "sha256:3fde9bd73b13a81024470c2e08de6e608ddea8cd79a88266028bcfc8c6a1bf61",
    "files_changed": 1,
    "files": [
      "CHANGELOG.md"
    ]
  },
  "ai_attestation": {
    "is_ai_authored": false,
    "signals_detected": [],
    "signal_count": 0,
    "is_bot_authored": false,
    "bot_signals_detected": [],
    "bot_signal_count": 0,
    "detection_method": "heuristic_v2"
  },
  "provenance": {
    "repository": "https://github.com/invariant-systems-ai/aiir",
    "tool": "https://github.com/invariant-systems-ai/aiir@1.0.3",
    "generator": "aiir.cli"
  },
  "receipt_id": "g1-5ac2f1d9d3ddbd789d13670e03bfd7d1",
  "content_hash": "sha256:5ac2f1d9d3ddbd789d13670e03bfd7d13d8459b0d54cdb61cb188e6d4ffb257f",
  "timestamp": "2026-03-08T14:09:57Z",
  "extensions": {}
}
