{
  "type": "aiir.commit_receipt",
  "schema": "aiir/commit_receipt.v1",
  "version": "1.0.7",
  "commit": {
    "sha": "eb1843825328b076f3d016e40e325290b26bfcaa",
    "author": {
      "name": "Invariant Systems",
      "email": "noah@invariantsystems.io",
      "date": "2026-03-08T13:15:52-04:00"
    },
    "committer": {
      "name": "Invariant Systems",
      "email": "noah@invariantsystems.io",
      "date": "2026-03-08T13:15:57-04:00"
    },
    "subject": "fix: unify all contact emails to noah@invariantsystems.io",
    "message_hash": "sha256:46863b0bd44d3b61293bf75152e52a399d919b2c24d1b00d081e8d4a8e15ff81",
    "diff_hash": "sha256:e514b064f01a10702c0403a6dfaf991c4fcc8376fc128f2a06337f34c35f6d60",
    "files_changed": 2,
    "files": [
      "SECURITY.md",
      "pyproject.toml"
    ]
  },
  "ai_attestation": {
    "is_ai_authored": false,
    "signals_detected": [],
    "signal_count": 0,
    "is_bot_authored": false,
    "bot_signals_detected": [],
    "bot_signal_count": 0,
    "authorship_class": "human",
    "detection_method": "heuristic_v2"
  },
  "provenance": {
    "repository": "https://github.com/invariant-systems-ai/aiir",
    "tool": "https://github.com/invariant-systems-ai/aiir@1.0.7",
    "generator": "aiir.cli"
  },
  "receipt_id": "g1-f701e17f24e76c1744ee7fe0feca749d",
  "content_hash": "sha256:f701e17f24e76c1744ee7fe0feca749d3fb083bbf64e964767aa3fe43e031183",
  "timestamp": "2026-03-08T17:16:17Z",
  "extensions": {}
}
