{
  "type": "aiir.commit_receipt",
  "schema": "aiir/commit_receipt.v1",
  "version": "1.0.3",
  "commit": {
    "sha": "61e75e7e2ce552dbaa99abfc9a5e3df13550f1f2",
    "author": {
      "name": "Invariant Systems",
      "email": "noah@invariantsystems.io",
      "date": "2026-03-08T08:48:19-04:00"
    },
    "committer": {
      "name": "Invariant Systems",
      "email": "noah@invariantsystems.io",
      "date": "2026-03-08T08:48:24-04:00"
    },
    "subject": "v1.0.3: module split + review response",
    "message_hash": "sha256:f4746e6c80eaec1d3f4d1a213b332000bcf0879498565e12df19db24fa2843fa",
    "diff_hash": "sha256:b9388cda78c219d32f3c565a1bb1b4a81175d588a50023ab8906aeec632edacf",
    "files_changed": 14,
    "files": [
      "CHANGELOG.md",
      "README.md",
      "THREAT_MODEL.md",
      "aiir/__init__.py",
      "aiir/_core.py",
      "aiir/_detect.py",
      "aiir/_github.py",
      "aiir/_ledger.py",
      "aiir/_receipt.py",
      "aiir/_sign.py",
      "aiir/_stats.py",
      "aiir/_verify.py",
      "aiir/cli.py",
      "test_cli.py"
    ]
  },
  "ai_attestation": {
    "is_ai_authored": false,
    "signals_detected": [],
    "signal_count": 0,
    "detection_method": "heuristic_v1"
  },
  "provenance": {
    "repository": "https://github.com/invariant-systems-ai/aiir",
    "tool": "https://github.com/invariant-systems-ai/aiir@1.0.3",
    "generator": "aiir.cli"
  },
  "receipt_id": "g1-7ec8b820524aa4203c5289eb64c4be87",
  "content_hash": "sha256:7ec8b820524aa4203c5289eb64c4be87b523efa12c81379a0f846c9eeb8934d5",
  "timestamp": "2026-03-08T12:48:36Z",
  "extensions": {}
}
