{
  "type": "aiir.commit_receipt",
  "schema": "aiir/commit_receipt.v1",
  "version": "1.0.0",
  "commit": {
    "sha": "37288aa2bf221b8f2ff24bfd5fa069b66cc60d8b",
    "author": {
      "name": "Invariant Systems",
      "email": "noah@invariantsystems.io",
      "date": "2026-03-07T21:41:49-05:00"
    },
    "committer": {
      "name": "Invariant Systems",
      "email": "noah@invariantsystems.io",
      "date": "2026-03-07T21:41:55-05:00"
    },
    "subject": "chore: CI ledger checks, publish workflow fix, changelog/README updates, export guard, combo tests",
    "message_hash": "sha256:44db1479b1a0416b25e88f32c2380822054e8d6bbfb89712d3aae07e7d507920",
    "diff_hash": "sha256:232747bff9d979c4c0fb0f5eabe8f4fc6eed0173533873a496162d778ce82aaf",
    "files_changed": 9,
    "files": [
      ".github/workflows/ci.yml",
      ".github/workflows/publish.yml",
      ".gitignore",
      ".pre-commit-hooks.yaml",
      "CHANGELOG.md",
      "README.md",
      "action.yml",
      "aiir/cli.py",
      "test_cli.py"
    ]
  },
  "ai_attestation": {
    "is_ai_authored": false,
    "signals_detected": [],
    "signal_count": 0,
    "detection_method": "heuristic_v1"
  },
  "provenance": {
    "repository": "https://github.com/invariant-systems-ai/aiir",
    "tool": "https://github.com/invariant-systems-ai/aiir@1.0.0",
    "generator": "aiir.cli"
  },
  "receipt_id": "g1-58aa8e08675bd157d43e69232c4f8ce7",
  "content_hash": "sha256:58aa8e08675bd157d43e69232c4f8ce7252ed2ccc4c6790603c69c0481c588e9",
  "timestamp": "2026-03-08T02:42:05Z",
  "extensions": {}
}
