{
  "type": "aiir.commit_receipt",
  "schema": "aiir/commit_receipt.v1",
  "version": "1.0.1",
  "commit": {
    "sha": "ff5c0c81c8a63673ac1e9537772cfc815617994c",
    "author": {
      "name": "Invariant Systems",
      "email": "noah@invariantsystems.io",
      "date": "2026-03-08T07:12:46-04:00"
    },
    "committer": {
      "name": "Invariant Systems",
      "email": "noah@invariantsystems.io",
      "date": "2026-03-08T07:12:54-04:00"
    },
    "subject": "docs: improve README copy and GitLab CI template",
    "message_hash": "sha256:641f55a2e0f7f2a87eabd9616416db4efbe1ac1a21850fb662a1e025208f588b",
    "diff_hash": "sha256:d3b043acd462dfad738caf29435f9b4b2286eeda757fedd7de962adccdf77c82",
    "files_changed": 2,
    "files": [
      "README.md",
      "templates/gitlab-ci.yml"
    ]
  },
  "ai_attestation": {
    "is_ai_authored": false,
    "signals_detected": [],
    "signal_count": 0,
    "detection_method": "heuristic_v1"
  },
  "provenance": {
    "repository": "https://github.com/invariant-systems-ai/aiir",
    "tool": "https://github.com/invariant-systems-ai/aiir@1.0.1",
    "generator": "aiir.cli"
  },
  "receipt_id": "g1-169e7c00b529582af7ffe5abf4b4ebb5",
  "content_hash": "sha256:169e7c00b529582af7ffe5abf4b4ebb5949e6528ea6182f6923537578fb611ee",
  "timestamp": "2026-03-08T11:13:02Z",
  "extensions": {}
}
