{
  "type": "aiir.commit_receipt",
  "schema": "aiir/commit_receipt.v1",
  "version": "1.0.2",
  "commit": {
    "sha": "7d82c6a80b55e56cfdb537c70702fecb3e3ee38b",
    "author": {
      "name": "Invariant Systems",
      "email": "noah@invariantsystems.io",
      "date": "2026-03-08T07:44:53-04:00"
    },
    "committer": {
      "name": "Invariant Systems",
      "email": "noah@invariantsystems.io",
      "date": "2026-03-08T07:45:09-04:00"
    },
    "subject": "fix: install git in CI jobs (python:3.11-slim lacks git)",
    "message_hash": "sha256:e7326cf8c096000e2734b44d06f40fc9eebddffb4b7ef2c9d0cb54eacc9bc26b",
    "diff_hash": "sha256:35274c3663b7d6ea5d03db2a96453697b31b2fbcd7f93816389cf0d410912b4a",
    "files_changed": 2,
    "files": [
      ".gitlab-ci.yml",
      "templates/receipt/template.yml"
    ]
  },
  "ai_attestation": {
    "is_ai_authored": false,
    "signals_detected": [],
    "signal_count": 0,
    "detection_method": "heuristic_v1"
  },
  "provenance": {
    "repository": "https://github.com/invariant-systems-ai/aiir",
    "tool": "https://github.com/invariant-systems-ai/aiir@1.0.2",
    "generator": "aiir.cli"
  },
  "receipt_id": "g1-616808c7a649fbb3fbf2f885c7d3a685",
  "content_hash": "sha256:616808c7a649fbb3fbf2f885c7d3a685248621e1c5c3888049fe42d3dcd454c4",
  "timestamp": "2026-03-08T11:45:17Z",
  "extensions": {}
}
